{
  "$schema": "urn:mcgen:schema:catalog-platform-index:1",
  "catalogId": "catalog.9dacda0438726d9cc8ae048a",
  "id": "catalog-platform.architectury.a122e1502b0d32a0469a3413",
  "platform": "architectury",
  "schemaVersion": 1,
  "shards": [
    {
      "bytes": 38223,
      "id": "catalog.architectury.49bf969b548d7ca28ad5c73a",
      "key": "10.0",
      "path": "catalog/2026-08-10-r3/platforms/architectury/10.0.091f296540cdd759ef7c2a0b32edfd80842244656516ccc027a03e35f5c116e3.json",
      "sha256": "091f296540cdd759ef7c2a0b32edfd80842244656516ccc027a03e35f5c116e3",
      "sourceSnapshots": [
        "architectury.df9f4c866e0c6749913054ad"
      ]
    },
    {
      "bytes": 5825,
      "id": "catalog.architectury.0dcc30be725d3f5ee5474772",
      "key": "10.1",
      "path": "catalog/2026-08-10-r3/platforms/architectury/10.1.c693bb62c03e2cb9841f434749df37ff6863e18d3a19732954b39b8d440c5a6a.json",
      "sha256": "c693bb62c03e2cb9841f434749df37ff6863e18d3a19732954b39b8d440c5a6a",
      "sourceSnapshots": [
        "architectury.df9f4c866e0c6749913054ad"
      ]
    },
    {
      "bytes": 24734,
      "id": "catalog.architectury.8d5078f7684827445c543e14",
      "key": "11.0",
      "path": "catalog/2026-08-10-r3/platforms/architectury/11.0.e62e77ea2a3860b5ff1f78bff04e0dc7ac088a5653243bbf387bbdbe9e11ab7e.json",
      "sha256": "e62e77ea2a3860b5ff1f78bff04e0dc7ac088a5653243bbf387bbdbe9e11ab7e",
      "sourceSnapshots": [
        "architectury.df9f4c866e0c6749913054ad"
      ]
    },
    {
      "bytes": 5825,
      "id": "catalog.architectury.c236932a0312a0dc0edd1cec",
      "key": "11.1",
      "path": "catalog/2026-08-10-r3/platforms/architectury/11.1.8d354dcb7da9542573ac1e2d278ef854f6cdb432859bf692ae2acaed0af81668.json",
      "sha256": "8d354dcb7da9542573ac1e2d278ef854f6cdb432859bf692ae2acaed0af81668",
      "sourceSnapshots": [
        "architectury.df9f4c866e0c6749913054ad"
      ]
    },
    {
      "bytes": 32984,
      "id": "catalog.architectury.2c4d925af55370e1075a9c89",
      "key": "12.0",
      "path": "catalog/2026-08-10-r3/platforms/architectury/12.0.a36f482e122b755c5012bb43e6ad8be890d204ece6ff695fe3e52ba686b73e18.json",
      "sha256": "a36f482e122b755c5012bb43e6ad8be890d204ece6ff695fe3e52ba686b73e18",
      "sourceSnapshots": [
        "architectury.df9f4c866e0c6749913054ad"
      ]
    },
    {
      "bytes": 8534,
      "id": "catalog.architectury.08706e61f2d52fd6b3ca583b",
      "key": "12.1",
      "path": "catalog/2026-08-10-r3/platforms/architectury/12.1.96a3aab46812b6f75e6e18aa3bb12a3f9a2a120b10de9f37928f4018a97c3093.json",
      "sha256": "96a3aab46812b6f75e6e18aa3bb12a3f9a2a120b10de9f37928f4018a97c3093",
      "sourceSnapshots": [
        "architectury.df9f4c866e0c6749913054ad"
      ]
    },
    {
      "bytes": 24800,
      "id": "catalog.architectury.0bc2c8fcd41da1114a7c936a",
      "key": "13.0",
      "path": "catalog/2026-08-10-r3/platforms/architectury/13.0.dc714dedf82e5ec34fec637fd3c794770a8130db8090ee786bf94075633a033e.json",
      "sha256": "dc714dedf82e5ec34fec637fd3c794770a8130db8090ee786bf94075633a033e",
      "sourceSnapshots": [
        "architectury.df9f4c866e0c6749913054ad"
      ]
    },
    {
      "bytes": 7625,
      "id": "catalog.architectury.9a1f58d5fb859079822b9c9d",
      "key": "14.0",
      "path": "catalog/2026-08-10-r3/platforms/architectury/14.0.b070ebfbf46062101a701d29753651c9fd9a424a6b340837b195c95de5c12e70.json",
      "sha256": "b070ebfbf46062101a701d29753651c9fd9a424a6b340837b195c95de5c12e70",
      "sourceSnapshots": [
        "architectury.df9f4c866e0c6749913054ad"
      ]
    },
    {
      "bytes": 8534,
      "id": "catalog.architectury.693f693f6a6dcc7b83264803",
      "key": "15.0",
      "path": "catalog/2026-08-10-r3/platforms/architectury/15.0.54fe93fc207d3b0a1e03cb0ac1dd48795830c85281003fda3ac0efe3133bb2fa.json",
      "sha256": "54fe93fc207d3b0a1e03cb0ac1dd48795830c85281003fda3ac0efe3133bb2fa",
      "sourceSnapshots": [
        "architectury.df9f4c866e0c6749913054ad"
      ]
    },
    {
      "bytes": 6716,
      "id": "catalog.architectury.bd3c083941e548a7a1248fe6",
      "key": "16.0",
      "path": "catalog/2026-08-10-r3/platforms/architectury/16.0.c5450144a112e3267c23a98e511ee6ac47df97a2ae00b6c1e72ac345aea9a897.json",
      "sha256": "c5450144a112e3267c23a98e511ee6ac47df97a2ae00b6c1e72ac345aea9a897",
      "sourceSnapshots": [
        "architectury.df9f4c866e0c6749913054ad"
      ]
    },
    {
      "bytes": 3116,
      "id": "catalog.architectury.ca0a38a5c9ca9911aff865f5",
      "key": "16.1",
      "path": "catalog/2026-08-10-r3/platforms/architectury/16.1.8d6661713dcd21a9f1609805359245fe89580271fe5eca7ce63ae0576d1c8f0d.json",
      "sha256": "8d6661713dcd21a9f1609805359245fe89580271fe5eca7ce63ae0576d1c8f0d",
      "sourceSnapshots": [
        "architectury.df9f4c866e0c6749913054ad"
      ]
    },
    {
      "bytes": 11243,
      "id": "catalog.architectury.5f313d760af2db10c7ae4617",
      "key": "17.0",
      "path": "catalog/2026-08-10-r3/platforms/architectury/17.0.791b32d2652e223dbd70ee47d3428da0571e4a3d9bc875270b353d355a7a9f8c.json",
      "sha256": "791b32d2652e223dbd70ee47d3428da0571e4a3d9bc875270b353d355a7a9f8c",
      "sourceSnapshots": [
        "architectury.df9f4c866e0c6749913054ad"
      ]
    },
    {
      "bytes": 16661,
      "id": "catalog.architectury.0f157eb27a31728285765083",
      "key": "18.0",
      "path": "catalog/2026-08-10-r3/platforms/architectury/18.0.392f02d03e44e75848346282923011b437f0571f95efb00442088e26b69788ae.json",
      "sha256": "392f02d03e44e75848346282923011b437f0571f95efb00442088e26b69788ae",
      "sourceSnapshots": [
        "architectury.df9f4c866e0c6749913054ad"
      ]
    },
    {
      "bytes": 3116,
      "id": "catalog.architectury.ca7912797308fdefd793889a",
      "key": "19.0",
      "path": "catalog/2026-08-10-r3/platforms/architectury/19.0.32d67a485bc262ff917279de95877d6b06740f4de035e86b78abc81223a08dea.json",
      "sha256": "32d67a485bc262ff917279de95877d6b06740f4de035e86b78abc81223a08dea",
      "sourceSnapshots": [
        "architectury.df9f4c866e0c6749913054ad"
      ]
    },
    {
      "bytes": 23774,
      "id": "catalog.architectury.e91c5dd66fd3e00eb4322b5e",
      "key": "2.0",
      "path": "catalog/2026-08-10-r3/platforms/architectury/2.0.5489e07c5c18985c545cc763cb6e83614f6e49517f8461f941aa63749500f64d.json",
      "sha256": "5489e07c5c18985c545cc763cb6e83614f6e49517f8461f941aa63749500f64d",
      "sourceSnapshots": [
        "architectury.df9f4c866e0c6749913054ad"
      ]
    },
    {
      "bytes": 5806,
      "id": "catalog.architectury.5dd69ab221e0d8a5c8105549",
      "key": "2.1",
      "path": "catalog/2026-08-10-r3/platforms/architectury/2.1.26e156f5594475e5a1559b3d323418f946b0f10ebc503d9a49c130cdb27fb6a1.json",
      "sha256": "26e156f5594475e5a1559b3d323418f946b0f10ebc503d9a49c130cdb27fb6a1",
      "sourceSnapshots": [
        "architectury.df9f4c866e0c6749913054ad"
      ]
    },
    {
      "bytes": 14815,
      "id": "catalog.architectury.85aba34db8bbc1d7be341e03",
      "key": "2.10",
      "path": "catalog/2026-08-10-r3/platforms/architectury/2.10.e40e21ef530818ecd4d7e108d210c690fac09ee152fb4860ad04da6bb563a12c.json",
      "sha256": "e40e21ef530818ecd4d7e108d210c690fac09ee152fb4860ad04da6bb563a12c",
      "sourceSnapshots": [
        "architectury.df9f4c866e0c6749913054ad"
      ]
    },
    {
      "bytes": 2206,
      "id": "catalog.architectury.84a28e9fe1d03d213fbc97a2",
      "key": "2.2",
      "path": "catalog/2026-08-10-r3/platforms/architectury/2.2.b89257c884c3d6e98fbea09d8bf22244475eb06223ea499f763926a181748b40.json",
      "sha256": "b89257c884c3d6e98fbea09d8bf22244475eb06223ea499f763926a181748b40",
      "sourceSnapshots": [
        "architectury.df9f4c866e0c6749913054ad"
      ]
    },
    {
      "bytes": 5806,
      "id": "catalog.architectury.89b44ff11a4a28d09d0ee80d",
      "key": "2.3",
      "path": "catalog/2026-08-10-r3/platforms/architectury/2.3.23312fe48f4e848ebdd83031a543fdbcf7a368efe3f671dfcdca2b8f142dff4c.json",
      "sha256": "23312fe48f4e848ebdd83031a543fdbcf7a368efe3f671dfcdca2b8f142dff4c",
      "sourceSnapshots": [
        "architectury.df9f4c866e0c6749913054ad"
      ]
    },
    {
      "bytes": 4006,
      "id": "catalog.architectury.022d92424e773badd1c2d998",
      "key": "2.4",
      "path": "catalog/2026-08-10-r3/platforms/architectury/2.4.4d6afa49d7168f56726c786aa3083bcd7993179f92985a1243c6e72d0406dfac.json",
      "sha256": "4d6afa49d7168f56726c786aa3083bcd7993179f92985a1243c6e72d0406dfac",
      "sourceSnapshots": [
        "architectury.df9f4c866e0c6749913054ad"
      ]
    },
    {
      "bytes": 11206,
      "id": "catalog.architectury.aa0c02573cdef52804a3b87c",
      "key": "2.5",
      "path": "catalog/2026-08-10-r3/platforms/architectury/2.5.9a7681b000d69b51cf8dad309c447c0826ede09494ca7f7bae2e94c17bddbf8b.json",
      "sha256": "9a7681b000d69b51cf8dad309c447c0826ede09494ca7f7bae2e94c17bddbf8b",
      "sourceSnapshots": [
        "architectury.df9f4c866e0c6749913054ad"
      ]
    },
    {
      "bytes": 2206,
      "id": "catalog.architectury.d29630306b5cb4ee8fbbdba5",
      "key": "2.6",
      "path": "catalog/2026-08-10-r3/platforms/architectury/2.6.e178f92ccb00eba6103d613504b706ffc160e4e136f933865df457f9cb071470.json",
      "sha256": "e178f92ccb00eba6103d613504b706ffc160e4e136f933865df457f9cb071470",
      "sourceSnapshots": [
        "architectury.df9f4c866e0c6749913054ad"
      ]
    },
    {
      "bytes": 22006,
      "id": "catalog.architectury.06757e9a685a78a5a4b7c7bb",
      "key": "2.8",
      "path": "catalog/2026-08-10-r3/platforms/architectury/2.8.700f99dbe6409189931bb88c1290c20a505c2b1ae2a1bf765e781130523c446d.json",
      "sha256": "700f99dbe6409189931bb88c1290c20a505c2b1ae2a1bf765e781130523c446d",
      "sourceSnapshots": [
        "architectury.df9f4c866e0c6749913054ad"
      ]
    },
    {
      "bytes": 2202,
      "id": "catalog.architectury.f44bb65cc319ea06b7e90e96",